question_no,question,0,1,2,3,answer,category
480,किस लिपि को सभी लिपियों का जन्म दाता कहा जाता है ?, खरोष्ठी, ब्राह्मी, मोडी, नागरी,1,General
481,किस काल की लिपि को चित्राकार लिपि कहा जाता है ?, सिन्धु काल, वैदिक काल, गुप्त काल, मौर्य काल,0,General
482,जैन सूत्र में कितनी लिपियों का उल्लेख है ?,8,12,18,21,2,General
483,बौद्ध ग्रन्थ 'ललित विस्तार' में कितनी लिपियों का उल्लेख है ?,19,27,64,89,3,General
484,अशोक के शिलालेखों की क्या लिपि है ?, देवनागरी, गुरुमुखी, खरोष्ठी, ब्राह्मी,3,General
485,भारत की तीसरी सर्वाधिक बोली जाने वाली भाषा है ?, तेलुगू, बांग्ला, मराठी, तमिल,0,General
486,चोल शासकों की भाषा क्या थी ?, तमिल, संस्कृत, कन्नड़, तेलुगू,0,General
487,हिन्दी भाषा भारतीयों का प्रतिशत लगभग कितना है ?, 50 %, 40 %, 45 %, 55 %,1,General
488,भारतीय भाषाओं में हिन्दी के बाद विश्व की कौन-सी भाषा अधिकतम बोली जाती है ?, मलयालम, तमिल, तेलुगू, बांग्ला,3,General
489,गोवा की स्वीकृत राजभाषा है ?, कोंकणी, गुजराती, मराठी, पुर्तगाली,0,General
490,कौन-सी भाषा देवभाषा है ?, हिन्दी, खड़ी भाषा, संस्कृत, पाली,2,General
491,भारत का प्राचीन भाषा है ?, संस्कृत, हिन्दी, पाली, प्राकृत,0,General
492,निम्नलिखित में से किस देश में अधिकतम संख्या में भाषाएँ बोली जाती हैं ?, ब्रिटेन, यू. एस. ए, फ्रांस, भारत,3,General
493,केन्द्रीय भारतीय भाषा संस्थान कहाँ स्थित है ?, मैसूर, हैदराबाद, वाराणसी, उज्जैन,0,General
494,राष्ट्रीय साक्षरता मिशन की शुरुआत कब हुई ?, 1900 ई., 1988 ई., 1999 ई., इनमें से कोई नहीं,1,General
495,राष्ट्रीय साक्षरता मिशन की शुरुआत कब हुई ?, 1900 ई., 1988 ई., 1999 ई., इनमें से कोई नहीं,1,General
496,नवोदय विद्यालय में दाखिला किस कक्षा में होता है ?, पहली, सातवीं, छठी, चौथी,2,General
497,मुक्त विश्वविद्यालय की स्थापना सर्वप्रथम कहाँ हुई ?, जर्मनी, भारत, इंग्लैंड, इनमें से कोई नहीं,2,General
498,इन्दिरा गाँधी राष्ट्रीय मुक्त विश्वविद्यालय की स्थापना कब हुई ?, 1982 ई., 1985 ई., 1987 ई., 1989 ई.,1,General
499,इन्दिरा गाँधी राष्ट्रीय मुक्त विश्वविद्यालय का मुख्यालय कहाँ है ?, नई दिल्ली, मुम्बई, इलाहाबाद, कोलकाता,0,General
500,केन्द्रीय अंग्रेजी एवं विदेशी भाषा संस्थान कहाँ है ?, हैदराबाद, मुम्बई, बंगलौर, नई दिल्ली,0,General
501,भारतीय पशु चिकित्सा अनुसन्धान संस्थान कहाँ स्थित है ?, पंतनगर, देहरादून, लखनऊ, इज्जतनगर,3,General
502,भारतीय खनन विद्यालय कहाँ स्थित है ?, राँची, धनबाद, जमशेदपुर, इनमें से कोई नहीं,1,General
503,फोर्ट विलियम कॉलेज कहाँ है ?, आगरा, नई दिल्ली, मुम्बई, कोलकाता,3,General
504,विश्वभारती विश्वविद्यालय की स्थापना किसने की थी ?, रवीन्द्रनाथ टैगोर, राजा राममोहन राय, बंकिम चन्द्र चटर्जी, इनमें से कोई नहीं,0,General
505,शिक्षा में सुधार हेतु ब्रिटिश सरकार ने सैडलर आयोग कब नियुक्त किया ?, 1911 में, 1917 में, 1920 में, 1922 में,1,General
506,मुगल काल में किस भाषा को रेख्तां कहा गया है ?, उर्दू, अरबी, तुर्की, फारसी,0,General
507,भारत की किस भाषा को ' इटालियन ऑफ द ईस्ट' कहा जाता है ?, तमिल, मलयालम, तेलुगू, बांग्ला,2,General
508,देश के एकमात्र किस राज्य की राजभाषा अंग्रेजी है ?, नगालैंड, सिक्किम, मणिपुर, मिजोरम,0,General
509,निम्नलिखित देशों में से किसमें तमिल एक प्रमुख भाषा है ?, म्यानमार, मौरीशस, सिंगापुर, इण्डोनेशिया,2,General
510,आमिर खुसरो ने किसके विकास में अग्रणी भूमिका निभाई ?, अवधी, भोजपुरी, ब्रज भाषा, खड़ी बोली,3,General
511,त्रिपुरा की राजभाषा है ?, हिन्दी, बांग्ला, मलयालम, नागा,1,General
512,निम्नलिखित में से कौन-से राज्य ने उर्दू को अपनी सरकारी भाषा के रूप में स्वीकृति प्रदान की है ?, राजस्थान, जम्मू-कश्मीर, आन्ध्र प्रदेश, मध्य प्रदेश,1,General
513,दूरदर्शन की प्रथम समाचार वाचिका कौन थी ?, शोभना जगदीश, अविनाश कौर सरीन, प्रतिमा पुरी, सलमा सुल्तान,2,General
514,दूरदर्शन का दैनिक राष्ट्रीय कार्यक्रम किस वर्ष आरंभ किया गया ?, 1980 ई., 1972 ई., 1975 ई., 1981 ई.,1,General
515,सबसे अधिक डाकघर किस देश में है ?, भारत, फ्रांस, जापान, चीन,0,General
516,"यदि पोस्टल इंडेक्स नम्बर ६ से शुरू हो, तो वह डाकघर संभवतः किस राज्य में स्थित होगा ?", महाराष्ट्र, कर्नाटक, केरल, इनमें से कोई नहीं,2,General
517,मुम्बई महानगर का STD कोड क्या है ?,11,22,33,44,1,General
518,निम्नलिखित में से किस भक्ति संत ने अपने संदेश के प्रचार के लिए सबसे पहले हिन्दी का प्रयोग किया ?, दादू, तुलसीदास, रामानंद, कबीर,2,General
519,भारत में मनीऑर्डर प्रणाली का प्रारम्भ हुआ ?, 1880 ई., 1882 ई., 1884 ई., 1907 ई.,0,General
520,भारत में डाक टिकट कब जारी किया गया ?, 1859 ई., 1854 ई., 1882 ई., इनमें से कोई नहीं,1,General
521,इन्दिरा गाँधी राष्ट्रीय मानव संग्रहालय कहाँ है ?, भोपाल, गुवाहाटी, चेन्नई, बस्तर,0,General
522,भारतीय सर्वेक्षण विभाग का मुख्यालय कहाँ स्थित है ?, हैदराबाद, नई दिल्ली, चण्डीगढ़, देहरादून,3,General
523,राजस्थान स्थित जावर की खानें किस खनिज के लिए प्रसिद्ध है ?, जस्ता, ताँबा, लोहा, ये सभी,0,General
524,धार्मिक कविताओं का संकलन 'कुरल' किस भाषा में है ?, ग्रीक, पालि, तेलुगू, तमिल,3,General
525,विधायिका को किस प्रकार की सरकार में कार्यपालिका से अधिक प्राथमिकता मिलती है ?, संघीय सरकार, संसदीय सरकार, अधिकारवादी सरकार, राष्ट्रपति सरकार,1,General
526,अनवार-ए-सुहैली' ग्रंथ किसका अनुवाद है ?, पंचतंत्र, सूरसागर, रामायण, महाभारत,0,General
527,एलायंस एयर निम्नलिखित में से किसके पूर्ण स्वामित्व वाली कम्पनी है ?, इण्डियन एयरलाइन्स, सहारा एयरवेज, जेट एयरवेज, एयर इण्डिया,0,General
528,निजी क्षेत्र में देश का पहला अन्तर्राष्ट्रीय हवाई अड्डा कहाँ निर्माणाधीन है ?, कोच्चि, गुवाहाटी, मोपा, हैदराबाद,0,General
529,भारत की अन्तर्राष्ट्रीय विमान सेवा है ?, सहारा एयर, इण्डियन एयरलाइन्स, एयर इण्डिया, एलायंस एयर,2,General
530,ग्रांड ट्रंक रोड किसने बनबायी ?, अकबर, जहाँगीर, शाहजहाँ, शेरशाह,3,General
531,स्वर्णिम चतुर्भुज परियोजना किससे सम्बन्धित है ?, सड़क परिवहन, वायु परिवहन, जल परिवहन, रेल परिवहन,0,General
532,पूर्व - पश्चिम एवं उत्तर दक्षिण एक्सप्रेस राजमार्ग एक-दूसरे को काटते हैं ?, ग्वालियर, सागर, भोपाल, झांसी,3,General
533,राष्ट्रीय राजमार्ग संख्या - 7 कितने राज्यों से होकर गुजरती है ?,4,5,6,7,2,General
534,निम्नलिखित में से कौन ऊर्जा के गैर परम्परागत स्त्रोत की श्रेणी में आता है ?, कोयला, बायो गैस, प्राकृतिक गैस, पेट्रोलियम,1,General
535,निम्नलिखित में से कौन ऊर्जा का परम्परागत स्त्रोत नहीं है ?, प्राकृतिक गैस, खनिज तेल, भूतापीय ऊर्जा, कोयला,2,General
536,निम्नलिखित में से किस प्रकार की ऊर्जा से सबसे कम वायु प्रदूषण होता है ?, जलीय ऊर्जा, तापीय ऊर्जा, नाभिकीय ऊर्जा, सौर ऊर्जा,3,General
537,मूंगफली में दाने का औसत प्रतिशत होता है ?,50,65,70,85,2,General
538,निम्नलिखित किस बाघ संरक्षण स्थल से हाल ही में बाघों का गुप्त रूप से अदृश्य होने की खबर है ?, रणथम्भौर, भरतपुर, सरिस्का, सिमलीपाल,2,General
539,विश्व का सर्वोच्च पर्वत शिखर एवरेस्ट नेपाल में किस नाम से प्रसिद्ध है ?, त्रिकूट, धवलगिरि, गौरीशंकर, सागरनाथ,0,General
540,नेपाल की राजधानी काठमांडू किस नदी के तट पर अवस्थित है ?, कोसी नदी के, गोदावरी नदी के, बागमती नदी के, नारायणी नदी,2,General
541,देवदास बंजारे किस क्षेत्र से जुड़े थे ?, पण्डवानी, पंथी नृत्य, ढोकरा नृत्य, घनकुल,1,General
542,बेगम अख्तर का नाम किससे सम्बद्ध है ?, शास्त्रीय वादन संगीत, सूफी गजल, शास्त्रीय गजल व ठुमरी, शास्त्रीय नृत्य,2,General
543,निम्नलिखित में से कौन हिंदुस्तानी शास्त्रीय संगीत में सुविख्यात है ?, शोभना नारायण, पंडित युवराज, एम. एस. सुब्बलक्ष्मी, इनमें से कोई नहीं,2,General
544,हिंदुस्तानी संगीत का सर्वाधिक प्राचीन घराना है ?, ग्वालियर घराना, लखनऊ घराना, जयपुर घराना, आगरा घराना,0,General
545,हिन्दुस्तानी संगीत का घराना नहीं है ?, किराना घराना, ग्वालियर घराना, लखनऊ घराना, आगरा घराना,2,General
546,ध्रुपद गायकी के लिए प्रसिद्ध घराना है ?, मेवाती घराना, जयपुर घराना, किराना घराना, ग्वालियर घराना,3,General
547,पण्डित भीम सेन जोशी हैं ?, बांसुरी वादक, हिंदुस्तानी गायक, सितार वादक, ओडिसी नर्तक,1,General
548,गायक की ध्रुपद शैली का आरम्भ किसने किया ?, अमीर खुसरो, विष्णु दिगंबर पलुस्कर, तानसेन, मानसिंह तोमर,3,General
549,ऋतू वर्मा का संबंध है ?, शास्त्रीय गायन से, गजल संगीत से, पंडवाणी शैली से, कर्नाटक संगीत से,2,General
550,माइकल जैक्सन संबंधित हैं ?, बैले नृत्य से, पियानो वादन से, जॉज गायन से, पॉप संगीत से,3,General
551,भातखण्डे संगीत महाविद्यालय कहाँ स्थित है ?, चण्डीगढ़, इलाहाबाद, लखनऊ, अहमदाबाद,2,General
552,अमीर खुसरो का नाम किस वाद्ययंत्र के आविष्कार से संबंधित है ?, सितार, सरोद, शहनाई, तबला,0,General
553,निम्नलिखित में से कौन-से एक हिंदुस्तानी शास्त्रीय संगीत का गायक/गायिका है ?, गीता चंद्रन, स्वप्न सुंदरी, गगूबाई हंगला, लीला सैम्बन,2,General
554,जैमिनी राय ने कला के किस क्षेत्र में नाम कमाया ?, मूर्तिकला, नाट्यकला, चित्रकला, संगीत,2,General
555,पश्चिम बंगाल में फर्शों पर चित्रकारी का कौन-सा रूप प्रसिद्ध है ?, आइपना, कोल्लभ, रंगोली, अल्पना,3,General
556,प्रसिद्ध मीनाकारी थेवा कला का संबंध है ?, बीकानेर से, प्रतापगढ़ से, बाँसवाड़ा से, जयपुर से,1,General
557,लोकनृत्य राहुल का संबंध उत्तर प्रदेश के निम्न में से किस एकक्षेत्र से है ?, पूर्वी क्षेत्र से, मध्य क्षेत्र से, बुन्देलखण्ड क्षेत्र से, पश्चिमी क्षेत्र से,2,General
558,नृत्य नाटक सूरदास एवं शंकरिया किस पेशेवर जाति से संबंध रखते हैं ?, पातर, भवाई, नट, भाण्ड,1,General
559,निम्नलिखित में से कौन सुमेलित नहीं है ?, आल्हा -महोबा, कजरी-मिर्जापुर, बिरहा - कन्नौज, रसिया - बरसाना,2,General
560,निम्नलिखित में से कौन-सा युग्म सुमेलित है ?, नकल - बिहार, अंकियानाट - असम, तमाशा - उड़ीसा, इनमें से कोई नहीं,1,General
561,निम्नलिखित में से कौन नृत्य विद्या से संबंधित नहीं है ?, चाचरी, चैती, बिहू, घूमर,1,General
562,लोक नृत्य करने वाले को कहते हैं ?, लौकिक, लोक नायक, लोक नर्तक, लोगों के साथ नाचना,2,General
563,भारतीय लोक नृत्य नहीं है ?, घूमर, डांडिया, गरबा, कथकली,3,General
564,छपेली लोक नृत्य संबंधित है ?, अरुणाचल प्रदेश, हिमाचल प्रदेश, उत्तर प्रदेश, आंध्र प्रदेश,1,General
565,निम्नलिखित नृत्यों में से गुजरात से संबंध रखने वाला नृत्य कौन-सा है ?, डांडिया, कुचीपुड़ी, बॉस नृत्य, बिदेशिया,0,General
566,किस भारतीय टेलिकॉम ऑपरेटर ने हाल ही में अपने ग्राहकों के लिए स्पीड पे(Speed Pay) की सेवा शुरू की है?, वोडाफोन, बीएसएनएल(BSNL), आइडिया सेल्युलर, भारती एयरटेल,1,General
567,निम्न में से लीप वर्ष है ?,1998,1994,1876,1758,2,General
568,इको सिस्टम शब्द का प्रयोग किसने किया ?, पि. स्तरहलर, पेंक, वि. लाल, ए. जी टेंसले,3,General
569,स्त्री -पुरुष में लिंग के आधार पर भेद न किय जाने को क्या कहते है ?, भेदभाव न करना, स्त्रियों के प्रति उदासीनता, जेंडर सबेदनशीलता, इनमें से कोई नहीं,2,General
570,भारत मे पहली बार सफेद बाघ कहाँ देखा गया ?, कोल्काता, रेवा, जलगाँव, भोपाल,1,General
571,हॅपी फेस स्पाइडर (Happy face spider) नामक मकडी कहाँ पायी जाती है ?, सब-सहारन अफ़्रीका, अफ्रिका, यूरोप, हेवाइयन आइलॅंड्स,3,General
572,"कब ""शस्त्र व्यापार संधि(Arms Trade Treaty)"" अस्तित्व में आई?"," दिसम्बर , 2014"," फरवरी, 2015"," जनवरी, 2015", उपरोक्त में से कोई नहीं,0,General
573,भारत रत्न से सम्मानित किए जाने वाले लोगों की सूची में कौन शामिल नहीं है ?, अटल बिहारी वाजपेयी, मदन मोहन मालवीय, केआर नारायणन, उपरोक्त में से कोई नहीं,2,General
574,24 दिसंबर देश में किस रूप में मनाया गया था, 29th राष्ट्रीय उपभोक्ता दिवस, सद्भावना दिवस, 1st राष्ट्रीय सुशासन दिवस, उपरोक्त सभी,0,General
575,मिशन इन्द्रधनुष  का संबंध किससे है?, टीकाकरण, अनौपचारिक कर्मचारी, इ-गवर्नेंस, महिला सुरक्षा,0,General
576,सूर्य किरण भारत और किस देश के बीच एक संयुक्त सैन्य अभ्यास है, बांग्लादेश, श्रीलंका, भूटान, नेपाल,3,General
577,TaxiforSure किसके द्वारा अधिग्रहीत किया गया है ?, मेरु कैब्स, ओला कैब्स, उबर इण्डीया, इनमें से कोई भी नहीं,1,General
578,दुनिया का पहला 3-डी मुद्रित जेट इंजन किस देश ने विकसित किया है ?, जर्मनी, ऑस्ट्रेलिया, जापान, अमेरीका,1,General
579,नालंदा विशवविधालय का संस्थापक था?, समुन्द्रगुप्त, कुमारगुप्त, स्कंदगुप्त, धर्मपाल,1,General
580,उज्जैन का प्राचीनकाल में क्या नाम था?, अवन्तिका, पाटलिपुत्र, तक्षशिला, इन्द्रप्रस्थ,0,General
581,भारत पर हूणों का आक्रमण किसके शासनकाल में हुआ था?, श्रीगुप्त, समुद्रगुप्त, स्कंदगुप्त, उपयुक्त,2,General
582,सांची का स्तूप किस शासक ने बनवाया था?, बिम्बसार, हर्षवर्धन, पुष्यमित्र, अशोक,3,General
583,अशोक के शिलालेखो को सर्वप्रथम किसने पढ़ा?, पाद्रेटी, विलियम जोन्स, जेम्स प्रिन्सेप, उपरोक्त में से कोई नहीं,2,General
